{
  "$schema": "https://json-schema.org/draft/2020-12/schema",
  "$id": "envelope.schema.json",
  "title": "Payload envelope",
  "description": "모든 데이터 파일의 공통 봉투. 정적 파일과 미래 API 응답이 같은 형태로 정규화되므로, 두 경로가 같은 도메인 결과를 만듭니다.",
  "type": "object",
  "required": [
    "items"
  ],
  "properties": {
    "schemaVersion": {
      "type": "integer",
      "minimum": 1,
      "default": 1
    },
    "dataVersion": {
      "type": "string",
      "description": "게시자의 빌드 id. 예: 2026.08.30.1"
    },
    "generatedAt": {
      "type": "string",
      "format": "date-time"
    },
    "payloadKind": {
      "enum": [
        "snapshot",
        "delta"
      ],
      "default": "delta",
      "description": "snapshot 이어야만 누락 레코드를 tombstone 처리합니다. delta 의 누락은 '변경 없음'을 뜻합니다."
    },
    "hasMore": {
      "type": "boolean",
      "default": false
    },
    "nextCursor": {
      "type": [
        "string",
        "null"
      ]
    },
    "tombstones": {
      "type": "array",
      "items": {
        "type": "string"
      },
      "description": "원천이 명시적으로 삭제를 선언한 sourceRecordId 목록."
    },
    "items": {
      "type": "array"
    }
  }
}
