{
  "schemaVersion": 1,
  "dataVersion": "2026.08.30",
  "generatedAt": "2026-08-30T00:00:00Z",
  "payloadKind": "snapshot",
  "hasMore": false,
  "items": [
    {
      "id": "game-demo-20260901-45",
      "status": "scheduled",
      "startTime": "2026-09-01T05:00:00Z",
      "localTimeZone": "Asia/Seoul",
      "homeTeamId": "team-demo-incheon",
      "awayTeamId": "team-demo-busan",
      "competitionId": "comp-demo-league",
      "seasonId": "season-demo-league-2026",
      "stageId": "stage-demo-2026-regular",
      "venueId": "venue-demo-incheon",
      "round": "1라운드",
      "source": {
        "sourceName": "demo-fixture",
        "sourceUrl": "app://demo/fixture",
        "fetchedAt": "2026-08-30T00:00:00Z",
        "qualityStatus": "autoVerified",
        "licenseStatus": "permitted",
        "visibility": "public",
        "isDemo": true,
        "sourceRecordId": "game-demo-20260901-45"
      }
    },
    {
      "id": "game-demo-20260902-23",
      "status": "scheduled",
      "startTime": "2026-09-02T05:00:00Z",
      "localTimeZone": "Asia/Seoul",
      "homeTeamId": "team-demo-suwon",
      "awayTeamId": "team-demo-goyang",
      "competitionId": "comp-demo-league",
      "seasonId": "season-demo-league-2026",
      "stageId": "stage-demo-2026-regular",
      "venueId": "venue-demo-suwon",
      "round": "1라운드",
      "source": {
        "sourceName": "demo-fixture",
        "sourceUrl": "app://demo/fixture",
        "fetchedAt": "2026-08-30T00:00:00Z",
        "qualityStatus": "autoVerified",
        "licenseStatus": "permitted",
        "visibility": "public",
        "isDemo": true,
        "sourceRecordId": "game-demo-20260902-23"
      }
    },
    {
      "id": "game-demo-20260904-pp",
      "status": "postponed",
      "statusNote": "우천 순연",
      "startTime": "2026-09-04T08:00:00Z",
      "localTimeZone": "Asia/Seoul",
      "homeTeamId": "team-demo-namsan",
      "awayTeamId": "team-demo-goyang",
      "competitionId": "comp-demo-league",
      "seasonId": "season-demo-league-2026",
      "venueId": "venue-demo-suwon",
      "source": {
        "sourceName": "demo-fixture",
        "sourceUrl": "app://demo/fixture",
        "fetchedAt": "2026-08-30T00:00:00Z",
        "qualityStatus": "autoVerified",
        "licenseStatus": "permitted",
        "visibility": "public",
        "isDemo": true,
        "sourceRecordId": "game-demo-20260904-pp"
      }
    },
    {
      "id": "game-demo-20260905-67",
      "status": "scheduled",
      "startTime": "2026-09-05T05:00:00Z",
      "localTimeZone": "Asia/Seoul",
      "homeTeamId": "team-demo-daegu",
      "awayTeamId": "team-demo-daejeon",
      "competitionId": "comp-demo-league",
      "seasonId": "season-demo-league-2026",
      "stageId": "stage-demo-2026-regular",
      "venueId": "venue-demo-busan",
      "round": "1라운드",
      "source": {
        "sourceName": "demo-fixture",
        "sourceUrl": "app://demo/fixture",
        "fetchedAt": "2026-08-30T00:00:00Z",
        "qualityStatus": "autoVerified",
        "licenseStatus": "permitted",
        "visibility": "public",
        "isDemo": true,
        "sourceRecordId": "game-demo-20260905-67"
      }
    },
    {
      "id": "game-demo-20260906-ca",
      "status": "cancelled",
      "startTime": "2026-09-05T20:00:00Z",
      "localTimeZone": "Asia/Seoul",
      "homeTeamId": "team-demo-daejeon",
      "awayTeamId": "team-demo-suwon",
      "competitionId": "comp-demo-league",
      "seasonId": "season-demo-league-2026",
      "venueId": "venue-demo-incheon",
      "source": {
        "sourceName": "demo-fixture",
        "sourceUrl": "app://demo/fixture",
        "fetchedAt": "2026-08-30T00:00:00Z",
        "qualityStatus": "autoVerified",
        "licenseStatus": "permitted",
        "visibility": "public",
        "isDemo": true,
        "sourceRecordId": "game-demo-20260906-ca"
      },
      "statusNote": "폭염 취소"
    },
    {
      "id": "game-demo-20260907-de",
      "status": "delayed",
      "startTime": "2026-09-06T17:00:00Z",
      "localTimeZone": "Asia/Seoul",
      "homeTeamId": "team-demo-hangang",
      "awayTeamId": "team-demo-goyang",
      "competitionId": "comp-demo-league",
      "seasonId": "season-demo-league-2026",
      "venueId": "venue-demo-busan",
      "source": {
        "sourceName": "demo-fixture",
        "sourceUrl": "app://demo/fixture",
        "fetchedAt": "2026-08-30T00:00:00Z",
        "qualityStatus": "autoVerified",
        "licenseStatus": "permitted",
        "visibility": "public",
        "isDemo": true,
        "sourceRecordId": "game-demo-20260907-de"
      },
      "statusNote": "우천 지연"
    },
    {
      "id": "game-demo-20260907-li",
      "status": "live",
      "startTime": "2026-09-07T01:00:00Z",
      "localTimeZone": "Asia/Seoul",
      "homeTeamId": "team-demo-namsan",
      "awayTeamId": "team-demo-incheon",
      "competitionId": "comp-demo-league",
      "seasonId": "season-demo-league-2026",
      "venueId": "venue-demo-hangang",
      "source": {
        "sourceName": "demo-fixture",
        "sourceUrl": "app://demo/fixture",
        "fetchedAt": "2026-08-30T00:00:00Z",
        "qualityStatus": "autoVerified",
        "licenseStatus": "permitted",
        "visibility": "public",
        "isDemo": true,
        "sourceRecordId": "game-demo-20260907-li"
      }
    },
    {
      "id": "game-demo-20260908-14",
      "status": "scheduled",
      "startTime": "2026-09-08T05:00:00Z",
      "localTimeZone": "Asia/Seoul",
      "homeTeamId": "team-demo-namsan",
      "awayTeamId": "team-demo-incheon",
      "competitionId": "comp-demo-league",
      "seasonId": "season-demo-league-2026",
      "stageId": "stage-demo-2026-regular",
      "venueId": "venue-demo-hangang",
      "round": "2라운드",
      "source": {
        "sourceName": "demo-fixture",
        "sourceUrl": "app://demo/fixture",
        "fetchedAt": "2026-08-30T00:00:00Z",
        "qualityStatus": "autoVerified",
        "licenseStatus": "permitted",
        "visibility": "public",
        "isDemo": true,
        "sourceRecordId": "game-demo-20260908-14"
      }
    },
    {
      "id": "game-demo-20260909-fo",
      "status": "forfeit",
      "startTime": "2026-09-08T18:00:00Z",
      "localTimeZone": "Asia/Seoul",
      "homeTeamId": "team-demo-suwon",
      "awayTeamId": "team-demo-busan",
      "competitionId": "comp-demo-league",
      "seasonId": "season-demo-league-2026",
      "venueId": "venue-demo-suwon",
      "source": {
        "sourceName": "demo-fixture",
        "sourceUrl": "app://demo/fixture",
        "fetchedAt": "2026-08-30T00:00:00Z",
        "qualityStatus": "autoVerified",
        "licenseStatus": "permitted",
        "visibility": "public",
        "isDemo": true,
        "sourceRecordId": "game-demo-20260909-fo"
      },
      "statusNote": "몰수 (인원 미달)",
      "homeScore": 9,
      "awayScore": 0
    },
    {
      "id": "game-demo-20260912-50",
      "status": "scheduled",
      "startTime": "2026-09-12T05:00:00Z",
      "localTimeZone": "Asia/Seoul",
      "homeTeamId": "team-demo-busan",
      "awayTeamId": "team-demo-hangang",
      "competitionId": "comp-demo-league",
      "seasonId": "season-demo-league-2026",
      "stageId": "stage-demo-2026-regular",
      "venueId": "venue-demo-busan",
      "round": "2라운드",
      "source": {
        "sourceName": "demo-fixture",
        "sourceUrl": "app://demo/fixture",
        "fetchedAt": "2026-08-30T00:00:00Z",
        "qualityStatus": "autoVerified",
        "licenseStatus": "permitted",
        "visibility": "public",
        "isDemo": true,
        "sourceRecordId": "game-demo-20260912-50"
      }
    },
    {
      "id": "game-demo-20260915-36",
      "status": "scheduled",
      "startTime": "2026-09-15T05:00:00Z",
      "localTimeZone": "Asia/Seoul",
      "homeTeamId": "team-demo-goyang",
      "awayTeamId": "team-demo-daegu",
      "competitionId": "comp-demo-league",
      "seasonId": "season-demo-league-2026",
      "stageId": "stage-demo-2026-regular",
      "venueId": "venue-demo-suwon",
      "round": "3라운드",
      "source": {
        "sourceName": "demo-fixture",
        "sourceUrl": "app://demo/fixture",
        "fetchedAt": "2026-08-30T00:00:00Z",
        "qualityStatus": "autoVerified",
        "licenseStatus": "permitted",
        "visibility": "public",
        "isDemo": true,
        "sourceRecordId": "game-demo-20260915-36"
      }
    },
    {
      "id": "game-demo-20260920-72",
      "status": "scheduled",
      "startTime": "2026-09-20T05:00:00Z",
      "localTimeZone": "Asia/Seoul",
      "homeTeamId": "team-demo-daejeon",
      "awayTeamId": "team-demo-suwon",
      "competitionId": "comp-demo-league",
      "seasonId": "season-demo-league-2026",
      "stageId": "stage-demo-2026-regular",
      "venueId": "venue-demo-incheon",
      "round": "4라운드",
      "source": {
        "sourceName": "demo-fixture",
        "sourceUrl": "app://demo/fixture",
        "fetchedAt": "2026-08-30T00:00:00Z",
        "qualityStatus": "autoVerified",
        "licenseStatus": "permitted",
        "visibility": "public",
        "isDemo": true,
        "sourceRecordId": "game-demo-20260920-72"
      }
    },
    {
      "id": "game-demo-20260926-40",
      "status": "scheduled",
      "startTime": "2026-09-26T05:00:00Z",
      "localTimeZone": "Asia/Seoul",
      "homeTeamId": "team-demo-incheon",
      "awayTeamId": "team-demo-hangang",
      "competitionId": "comp-demo-league",
      "seasonId": "season-demo-league-2026",
      "stageId": "stage-demo-2026-regular",
      "venueId": "venue-demo-hangang",
      "round": "4라운드",
      "source": {
        "sourceName": "demo-fixture",
        "sourceUrl": "app://demo/fixture",
        "fetchedAt": "2026-08-30T00:00:00Z",
        "qualityStatus": "autoVerified",
        "licenseStatus": "permitted",
        "visibility": "public",
        "isDemo": true,
        "sourceRecordId": "game-demo-20260926-40"
      }
    }
  ]
}
